{
    "name": "Default mod name",
    "description": "Put your mod's description here",
    "modVersion": "1.0.0",
    "OnGameStart": {
        "luaFiles": [
            "script.lua"
        ]
    },
    "targetVersion": "0.96.6",
    "languageCode": "en",
    "doNotChangeVariablesBelowThis": {
        "timeCreated": 639137165335025018,
        "guid": {
            "serializedGuid": "1fd7745a-351d-4dde-8006-ff4be2476da2"
        }
    }
}